{
  "contractVersion": "1.0.0",
  "experimentRunId": "experiment_run_01",
  "variantId": "variant_model_a",
  "trialId": "trial_model_a_01",
  "trialOrdinal": 1,
  "baselineSnapshotRef": "artifact://sha256/eeeeeeeeeeeeeeeeeeeeeeeeeeeeeeeeeeeeeeeeeeeeeeeeeeeeeeeeeeeeeeee",
  "baselineSnapshotDigest": "sha256:eeeeeeeeeeeeeeeeeeeeeeeeeeeeeeeeeeeeeeeeeeeeeeeeeeeeeeeeeeeeeeee",
  "subject": {
    "type": "workflow_run",
    "id": "run_trial_model_a_01"
  },
  "status": "completed",
  "analysisDisposition": "included",
  "resultRef": "artifact://sha256/ffffffffffffffffffffffffffffffffffffffffffffffffffffffffffffffff",
  "evaluationResultRefs": ["evaluation_result_trial_a_01"],
  "usageRef": "usage_trial_a_01",
  "startedAt": "2026-07-13T09:00:00Z",
  "completedAt": "2026-07-13T09:05:00Z"
}
